{
  "slug": "too-expensive",
  "target_query": "how to handle too expensive sales objection",
  "objection_phrase": "this is too expensive",
  "search_intent": "mixed",
  "page_title": "How to Handle the \"Too Expensive\" Objection (Without Discounting) - Brutus AI",
  "meta_description": "The 'too expensive' sales objection is rarely about price. Diagnose the real meaning on this call and respond without dropping your price.",
  "h1": "how to handle the \"too expensive\" objection without dropping your price",
  "intro": "\"too expensive\" is almost never just a price problem. it can be a real budget gap, a value misunderstanding, an anchor mismatch, or a different buying concern hiding behind the number. defend the wrong meaning and you lose the deal. discount the wrong meaning and you train the prospect to push you every quarter. either way, you bleed margin you did not have to. the dangerous part is how fast reps answer. the prospect says the number feels high, and the rep starts justifying, listing features, or cutting price before they know what the objection actually means on this call. slow down. diagnose the real meaning in under 30 seconds. then give the right response, not the reflex one.",
  "example_dialog": [
    {
      "speaker": "prospect",
      "line": "honestly, that's way too expensive."
    },
    {
      "speaker": "rep",
      "line": "ok, hold on. when you say expensive, are you saying you don't have the budget for it, or that you're not sure it's worth that much?"
    },
    {
      "speaker": "prospect",
      "line": "honestly... probably the second one. I don't see how it pays for itself."
    },
    {
      "speaker": "rep",
      "line": "that's a different conversation. what's the problem costing you per month right now?"
    }
  ],
  "psychology": "people do not judge price against value first. they judge price against a reference point. the first dollar figure they hear in a category becomes the anchor. when your number lands above that anchor, \"too expensive\" can come out before they have processed what they are buying. the right move is to surface the anchor, reset it if it is wrong, or confirm that the budget gap is real.",
  "counter_frames": [
    {
      "label": "real budget gap",
    "copy": "switch to scope, not price. if the budget gap is real, cut scope or timing instead of discounting the same package."
    },
    {
      "label": "value misunderstanding",
    "copy": "re-anchor on the cost of doing nothing. the prospect has not connected the price to the problem yet, so the number lands as a shock instead of a tradeoff."
    },
    {
      "label": "anchoring reflex",
    "copy": "surface the anchor. ask what number they had in mind and where that number came from. the answer usually tells you whether you are too high, too early, or too broad."
    }
  ],
  "common_mistakes": [
    "defending the price before diagnosing the meaning of the objection. fix: slow down, ask which kind of expensive this is, and let them name it before you respond.",
    "offering a discount in the first 60 seconds after the objection. fix: never discount on a reflex. discounts answer real price gaps, not value or anchoring problems.",
    "listing more features when the prospect is asking a value or anchor question. fix: answer the concern they actually raised, not the one you wish they had raised.",
    "asking 'compared to what' too early. fix: surface the anchor first ('what number did you have in mind?'), then compare.",
    "restating the number louder instead of changing the conversation. fix: change the scope, the timing, or the anchor before you change the number."
  ],
  "walk_away_when": [
    "the prospect can name a hard ceiling and a documented reason for it, and your minimum is above it",
    "price keeps coming back after multiple rounds of diagnostic and counter-frame",
    "the prospect keeps asking for a discount without engaging on scope or value"
  ],
  "brutus_angle": "Brutus catches the moment a rep starts defending price, listing features, or floating a discount in the opening reaction. the live cue is: \"don't defend. ask which kind of expensive.\"",
  "related_slugs": [
    "competitor-is-cheaper",
    "no-budget",
    "need-to-think-about-it"
  ],
  "cta_variant": "Stop defending price on calls. Try Brutus free for 5 calls and let it call out the moment you start justifying.",
  "faq_questions": [
    "Is 'too expensive' ever a real price problem?",
    "Should I ever discount on the 'too expensive' objection?",
    "How do I tell anchoring from a real budget gap?"
  ],
  "author": {
    "name": "Isaiah Rios",
    "company": "Brutus AI"
  },
  "status": "published",
  "demand_verified": true,
  "notes": "Gold-standard wave 1 published article. HTML output at website/objections/too-expensive.html. Person author schema (Isaiah Rios, founder) rendered in JSON-LD and visible byline."
}
