{
  "slug": "need-to-think-about-it",
  "target_query": "how to handle i need to think about it objection",
  "objection_phrase": "we need to think about it",
  "search_intent": "mixed",
  "page_title": "How to Handle \"I Need to Think About It\" Without Losing the Deal - Brutus AI",
  "meta_description": "\"I need to think about it\" usually hides price, authority, or trust. Use the three-blocker diagnostic before accepting a vague follow-up.",
  "h1": "how to handle \"i need to think about it\" without losing the deal",
  "intro": "\"let me think about it\" is never about thinking. not really. it is usually one of three things the prospect does not want to say to your face: the price is not working, the person you are talking to cannot say yes, or they do not trust the decision enough yet. the phrase lands at the worst possible moment, right when the rep feels closest to a yes. that is why so many reps accept it. they do not want to break the mood. they schedule a vague follow-up and tell themselves the deal is still alive. it usually is not. if you accept the stall, the deal cools the second the call ends. if you guess wrong, you discount too early, send proof nobody asked for, or chase a follow-up that goes nowhere.",
  "example_dialog": [
    {
      "speaker": "prospect",
      "line": "this looks good. I just need some time to think it over."
    },
    {
      "speaker": "rep",
      "line": "sure, no problem. how about I follow up next week?"
    },
    {
      "speaker": "prospect",
      "line": "yeah, that works."
    },
    {
      "speaker": "rep",
      "line": "before we do that, help me understand what part needs more thought. is it price, getting others aligned, or confidence this will actually work?"
    },
    {
      "speaker": "prospect",
      "line": "mostly getting others aligned. my CFO will want to see the implementation risk."
    }
  ],
  "psychology": "the end of a demo creates two pressures at once. saying yes creates commitment. saying no creates conflict. \"let me think about it\" releases both pressures and lets the prospect leave without choosing. that feels harmless in the moment, but the deal loses heat fast. decision fatigue makes the exit even more tempting. the prospect has processed features, pricing, timing, and risk. if the rep does not help sort the hesitation while the call is still live, the hesitation turns into silence.",
  "counter_frames": [
    {
      "label": "price diagnostic",
      "copy": "ask: \"if we set price aside for a second, would the rest of this be a yes?\" it surfaces price without leading with your insecurity."
    },
    {
      "label": "authority diagnostic",
      "copy": "ask: \"is the thinking just on your end, or are there others who weigh in?\" now you know if the blocker is people, not thought."
    },
    {
      "label": "trust diagnostic",
      "copy": "ask: \"what would you need to see to feel confident saying yes?\" proof becomes specific instead of random."
    },
    {
      "label": "clean hesitation check",
      "copy": "if all three come back clean, ask what is still making them hesitate. do not schedule a vague follow-up around a vague concern."
    }
  ],
  "common_mistakes": [
    "scheduling a vague follow-up and calling it next steps. fix: any follow-up needs a named blocker attached. 'we will talk thursday' is not progress. 'we will talk thursday after you walk this past the CFO' is.",
    "sending more case studies without knowing the missing proof. fix: ask which kind of proof would change their mind, then send only that. random social proof reads like filler.",
    "dropping the price before price has been named. fix: run the price diagnostic question first. discounting an objection nobody raised teaches the prospect your number was inflated.",
    "asking 'is it the price?' first and signaling that you think it is. fix: ask the neutral version. 'if we set price aside, would the rest of this be a yes?' lets price surface without you leading them to it.",
    "letting the prospect leave without naming the blocker. fix: end the call by either confirming a blocker and a next step, or honestly admitting you don't have one and asking for one. silence after the call is the signal you missed it.",
    "treating all three blockers like the same problem. fix: price gets a scope or value answer. authority gets a multi-thread answer. trust gets a proof answer. do not bring scope to a trust problem."
  ],
  "walk_away_when": [
    "the prospect names a specific stakeholder concern outside their control",
    "a real approval event will not happen for 90 days or more",
    "security, board, or CFO review has not started and nobody owns pushing it"
  ],
  "brutus_angle": "Brutus listens for the polite-stall pattern at the end of a pitch: vague timing, positive language, and no specific concern named. the live cue is: \"don't schedule a follow-up. ask which of the three blockers is in the way.\"",
  "related_slugs": [
    "too-expensive",
    "no-budget",
    "bad-timing"
  ],
  "cta_variant": "Hear yourself accept a stall in real time. Brutus surfaces the diagnostic question before you say goodbye. First 5 calls free.",
  "faq_questions": [
    "What if they really do just need time?",
    "How long should the diagnostic take?",
    "Should I ever just accept the stall?"
  ],
  "author": {
    "name": "Isaiah Rios",
    "company": "Brutus AI"
  },
  "status": "published",
  "demand_verified": true,
  "notes": "Wave 1 published article. HTML at website/objections/need-to-think-about-it.html. Person author schema (Isaiah Rios, founder) rendered in JSON-LD and visible byline."
}
